{
  "title": "Absent Dealer",
  "requires-steamodded": true,
  "requires-talisman": false,
  "categories": [
    "Content",
    "Joker"
  ],
  "author": "Absent Abigail",
  "repo": "https://github.com/AbsentAbigail/AbsentDealer",
  "downloadURL": "https://github.com/AbsentAbigail/AbsentDealer/releases/latest/download/absentdealer.zip",
  "folderName": "AbsentDealer",
  "version": "v1.3.3",
  "automatic-version-check": true
}
