{
  "title": "Flush Hotkeys",
  "requires-steamodded": true,
  "requires-talisman": false,
  "categories": [
    "Quality of Life"
  ],
  "author": "Agoraaa",
  "folderName": "FlushHotkeys",
  "repo": "https://github.com/Agoraaa/FlushHotkeys",
  "downloadURL": "https://github.com/Agoraaa/FlushHotkeys/archive/refs/heads/main.zip",
  "automatic-version-check": true,
  "version": "2f0a91f"
}
