{
  "title": "Sebalatro",
  "requires-steamodded": true,
  "requires-talisman": false,
  "categories": [
    "Resource Packs"
  ],
  "author": "SebasContre",
  "repo": "https://github.com/sebascontre/sebalatro",
  "downloadURL": "https://github.com/sebascontre/sebalatro/archive/refs/heads/main.zip",
  "folderName": "Sebalatro",
  "automatic-version-check": true,
  "version": "b05df96"
}
