{
  "title": "Starrailevents",
  "requires-steamodded": true,
  "requires-talisman": false,
  "categories": [
    "Content"
  ],
  "author": "snowylight",
  "repo": "https://github.com/snowylight/Multipack",
  "downloadURL": "https://github.com/snowylight/Multipack/archive/refs/tags/V2.2.0.zip",
  "automatic-version-check": true,
  "version": "V2.2.0"
}
