{
  "title": "Menthol",
  "requires-steamodded": true,
  "requires-talisman": false,
  "categories": [
    "Content"
  ],
  "author": "wingedcatgirl",
  "repo": "https://github.com/wingedcatgirl/MintysSillyMod",
  "downloadURL": "https://github.com/wingedcatgirl/MintysSillyMod/releases/download/v1.0.0/Menthol-1.0.0.zip",
  "automatic-version-check": false,
  "version": "v1.0.0"
}

