{
  "title": "MobileLikeDragging",
  "requires-steamodded": false,
  "requires-talisman": false,
  "categories": [
    "Patch"
  ],
  "author": "PIPIKAI",
  "repo": "https://github.com/PIPIKAI/MobileLikeDragging",
  "downloadURL": "https://github.com/PIPIKAI/MobileLikeDragging/archive/refs/heads/main.zip",
  "automatic-version-check": true,
  "version": "67421f4"
}
