{
  "title": "peakshitmod",
  "requires-steamodded": true,
  "requires-talisman": false,
  "categories": [
    "Content",
    "Joker"
  ],
  "author": "peakshitposts",
  "repo": "https://github.com/peakshitposts/peakshitmod",
  "downloadURL": "https://github.com/peakshitposts/peakshitmod/releases/latest/download/peakshitmod-main.zip",
  "folderName": "peakshitmod",
  "version": "evennewer",
  "automatic-version-check": true
}
